<?xml version="1.0" encoding="utf-8" ?>
<es:mappings
	targerNamespace="http://everydaysolutions.de/schemas/"
   xmlns:es="http://everydaysolutions.de/schemas/"
	es:schemaLocation="es file:///d:/esolutions/esolutions/microkernel.mappings.xsd">
	<es:typeGroups>
		<es:typeGroup name="one">
			<es:types>
				<!-- InitializeWithDuplicateAssemblyMappings -->
				<es:type interfaceName="ESolutions.Test.Interfaces.IDependencyMapping06">
					<es:desclaringAssembly name="ESolutions.Test, Version=1.0.0.0, Culture=neutral, PublicKeyToken=null" />
					<es:implementingType fullName="ESolutions.Test.Mocker.DependencyMapping06" />
				</es:type>
			</es:types>
		</es:typeGroup>
	</es:typeGroups>
	<es:assemblies fallbackPath="C:\Code\ESolutions\ESolutions.Test\bin\Debug">
		<es:assembly name="ESolutions.Test, Version=1.0.0.0, Culture=neutral, PublicKeyToken=null" pathToFile="C:\Code\ESolutions\ESolutions.Test\bin\Debug" fileName="ESolutions.Test.dll" />
		<es:assembly name="ESolutions.Test, Version=1.0.0.0, Culture=neutral, PublicKeyToken=null" pathToFile="C:\Code\ESolutions\ESolutions.Test\bin\Debug" fileName="ESolutions.Test.dll" />
	</es:assemblies>	
</es:mappings>