<?xml version="1.0" encoding="utf-8" ?>
<es:mappings
	targerNamespace="http://everydaysolutions.de/schemas/"
   xmlns:es="http://everydaysolutions.de/schemas/"
	es:schemaLocation="es file:///d:/esolutions/esolutions/microkernel.mappings.xsd">
	<es:typeGroups>
		<es:typeGroup name="one">
			<es:types>
				<!-- CreateInstanceWithoutDependencies -->
				<es:type interfaceName="ESolutions.Test.Interfaces.ISimpleMapping">
					<es:desclaringAssembly name="ESolutions.Test, Version=1.0.0.0, Culture=neutral, PublicKeyToken=null" />
					<es:implementingType fullName="ESolutions.Test.Mocker.SimpleMapping" />
				</es:type>
				<!-- CreateInstanceWithMappedDependency -->
				<es:type interfaceName="ESolutions.Test.Interfaces.IDependencyMapping01">
					<es:desclaringAssembly name="ESolutions.Test, Version=1.0.0.0, Culture=neutral, PublicKeyToken=null" />
					<es:implementingType fullName="ESolutions.Test.Mocker.DependencyMapping01" />
				</es:type>
				<es:type interfaceName="ESolutions.Test.Helper.Contracts.IDependency01">
					<es:desclaringAssembly name="ESolutions.Test.Helper, Version=1.0.0.0, Culture=neutral, PublicKeyToken=null" />
					<es:implementingType fullName="ESolutions.Test.Helper.Dependency01" />
				</es:type>
				<!-- CreateInstanceWithIndirectDependencyMapped -->
				<es:type interfaceName="ESolutions.Test.Interfaces.IDependencyMapping02">
					<es:desclaringAssembly name="ESolutions.Test, Version=1.0.0.0, Culture=neutral, PublicKeyToken=null" />
					<es:implementingType fullName="ESolutions.Test.Mocker.DependencyMapping02" />
				</es:type>
				<es:type interfaceName="ESolutions.Test.Helper.Contracts.IDependency02">
					<es:desclaringAssembly name="ESolutions.Test.Helper, Version=1.0.0.0, Culture=neutral, PublicKeyToken=null" />
					<es:implementingType fullName="ESolutions.Test.Helper.Dependency02" />
				</es:type>
				<!-- CreateInstanceWithoutTypeMapping -->
				<!-- none -->
				<!-- CreateInstanceWithoutAssemblyMapping -->
				<es:type interfaceName="ESolutions.Test.Interfaces.IDependencyMapping04">
					<es:desclaringAssembly name="ESolutions.Test.Unmapped, Version=1.0.0.0, Culture=neutral, PublicKeyToken=null" />
					<es:implementingType fullName="ESolutions.Test.Mocker.DependencyMapping04" />
				</es:type>
				<!-- CreateInstanceWithoutAssemblyContainingType -->
				<es:type interfaceName="ESolutions.Test.Interfaces.IDependencyMapping05">
					<es:desclaringAssembly name="ESolutions.Test, Version=1.0.0.0, Culture=neutral, PublicKeyToken=null" />
					<es:implementingType fullName="ESolutions.Test.Mocker.DependencyMapping05" />
				</es:type>
				<!-- CreateInstanceNotImplementingInterface -->
				<es:type interfaceName="ESolutions.Test.Interfaces.IDependencyMapping06">
					<es:desclaringAssembly name="ESolutions.Test, Version=1.0.0.0, Culture=neutral, PublicKeyToken=null" />
					<es:implementingType fullName="ESolutions.Test.Mocker.DependencyMapping06" />
				</es:type>
				<!-- CreateInstanceWithIndirectDependency -->
				<es:type interfaceName="ESolutions.Test.Interfaces.IDependencyMapping07">
					<es:desclaringAssembly name="ESolutions.Test, Version=1.0.0.0, Culture=neutral, PublicKeyToken=null" />
					<es:implementingType fullName="ESolutions.Test.Mocker.DependencyMapping07" />
				</es:type>
			</es:types>
		</es:typeGroup>
	</es:typeGroups>
	<es:assemblies fallbackPath="d:\code\esolutions\out">
		<es:assembly name="ESolutions.Test, Version=1.0.0.0, Culture=neutral, PublicKeyToken=null" pathToFile="D:\code\ESolutions\ESolutions.Test\bin\Debug\" fileName="ESolutions.Test.dll" />
		<es:assembly name="ESolutions.Test.Helper, Version=1.0.0.0, Culture=neutral, PublicKeyToken=null" pathToFile="D:\code\ESolutions\ESolutions.Test.Helper\bin\Debug" fileName="ESolutions.Test.Helper.dll" />
	</es:assemblies>	
</es:mappings>